,,,,,,,,FROM EBIRD/HISTORICAL WEATHER DATA,Northernly distribution (place),,,,,Southernly distribution (place),,,,,Date of arrival to northernly distribution,,,,,Mean temp (F) at arrival to northernly distribution,,,,,Min temp (F) at arrival to northernly distribution,,,,,Max temp (F) at arrival to northernly distribution,,,,,Date of arrival to southernly distribution,,,,,Mean temp at arrival to southernly distribution,,,,,Min temp at arrival to southernly distribution,,,,,Max temp at arrival to southernly distribution,,,,,Max temp while in northern distribution,,,,,Max temp while in southern distribution,,,,,Min temp while in northern distribution,,,,,Min temp while in southern distribution,,,,,Mean temp while in northern distribution,,,,,Mean temp while in southern distribution,,,,,,,
Species scientific name,Species common name,Body mass (g),UCT,LCT,Reference,Comments,,,2019,2018,2017,2016,2015,2019,2018,2017,2016,2015,2019,2018,2017,2016,2015,2019,2018,2017,2016,2015,2019,2018,2017,2016,2015,2019,2018,2017,2016,2015,2019,2018,2017,2016,2015,2019,2018,2017,2016,2015,2019,2018,2017,2016,2015,2019,2018,2017,2016,2015,2019,2018,2017,2016,2015,2019,2018,2017,2016,2015,2019,2018,2017,2016,2015,2019,2018,2017,2016,2015,2019,2018,2017,2016,2015,2019,2018,2017,2016,2015,,,
Aegolius_acadicus,Northern Saw-whet Owl,118.1,31.8,*,Ligon 1969,,,,"Kenai Peninsula, Alaska","George Lake, Athabasca, Alberta, Canada","Ningunsaw Park, Kitimat-Stikine, British Columbia, Canada","North Interlake Area, Manitoba, Canada","Naikoon Provicial Park, Skeena-Queen Charlotte, British Columbia, Canada","Cerro El Potosí, Mexico","Unidad de Manejo Raíces, Mexico","Johnson Mesa, San Miguel, New Mexico","San Miguel, New Mexico","Grants, New Mexico",April 27,April 9,October 25,March 28,October 21,41.75,26,35.3,30.17,39,25,9,32,21,36,54,36,43,37,46,July 20,February 1,April 22,June 10,November 2,86.25,49.89,66.42,87.07,55.92,73,34,55,76,43,100,68,79,100,71,89,90,61,n/a,n/a,n/a,81,99,105,71,24,-13,-18,n/a,n/a,n/a,34,26,20,18,49.85,41.48,25.65,n/a,n/a,n/a,56.08,65.54,68.99,40.51,,,
Aegotheles_cristatus,Australian Owlet-Nightjar,45.56,34.8,31.3,Doucette and Geiser 2008,,,,"Roper Gulf, Australia (Limmen Bight National Park)","Northeast Top End, Australia (Anniversary Creek near Litchfield National Park)","West Arnham, Australia ","Barkley, Australia (near Lakewoods Conservation Covenant)","West Arnham, Australia (Kakadu National Park)","Greater Bendigo, Australia (Costerfield State Forest","Strathbogie, Australia (Heathcote-Graytown National Park","Lodden, Australia (Mount Korong Nature Conservation Reserve)","Hepburn, Australia (Rise and Shine Bushland Reserve)","Murray, Australia (Murray Valley Regional Park)",Oct. 18,June 30,August 20,March 28,June 24,88.19,83.97,83.87,88.29,81.84,81,75,73,82,73,97,91,91,91,90,Dec. 14,Sept. 21,Aug. 12,Feb. 28,May 13,61.75,53.34,55.38,65.94,53.69,57,43,50,61,46,70,64,63,73,59,n/a,95,n/a,n/a,n/a,111,102,100,104,72,n/a,61,n/a,n/a,n/a,45,36,34,45,63,n/a,78.78,n/a,n/a,n/a,66.03,59.94,58.67,67.36,51.53,,,
Agelaius_phoeniceus,Red-winged Blackbird,70.3,40,27.5,Lewies and Dyer 1969,,,,"Southeast Fairbanks, Alaska (near Tanana Valley State Forest)","Coot Lake, Yukon, Canada","Healy Lake, Southeast Fairbanks, Alaska","Valdez-Cordova, Alaska (Kenny Lake, near Wrangell-St. Elias National Park and Reserve)","Southeast Fairbanks, Alaska","Puerto Chomes, Costa Rica","Llanos de Pozo de Agua, Costa Rica (near Palo Verde National Park)","Refugio Nacional de Vida Silvestre Cipanci, Costa Rica","Matina, Costa Rica (near Parque Nacional Barbilla)","Puerto Chomes, Costa Rica",May 22,June 3,July 23,June 17,May 30,59.83,53.7,68.75,57.65,61.33,46,36,56,46,47,72,70,80,66,72,Nov. 15,May 11,Nov. 28,Feb. 3,May 9,74.2,75.92,80.05,79.44,83.04,64,68,68,72,68,79,84,90,84,86,88,n/a,84,82,85,82,n/a,n/a,88,86,15,n/a,-2,3,30,64,n/a,n/a,59,64,53.33,n/a,50.59,43.52,56.92,73.64,n/a,n/a,76.17,75.43,,,
Alaemon_alaudipes,Hoopoe Lark,37.7,37.5,32.7,Tieleman et al. 2002,,,,"Risha, Jordan (near border of Jordan and Syria)","Bou-Hedma National Park, Tunisia","Kef El Doukhan ou Oued M'Zab, Algeria (near Ghardaia)","Lagune de Ghlissia, Tunisia (near Chott el Djerid)","Tisserdmine, Morrocco","Lake Abhe, Southeastern Shore, Djibouti","Boa Vista, Cape Verde","Boa Vista, Cape Verde","Boa Vista, Cape Verde","Boa Vista, Cape Verde",February 8,March 20,May 12,February 14,May 11,48.8,60.58,92.75,68.7,83.58,46,50,81,61,68,54,70,102,75,95,Sept. 29,March 18,April 14,Oct. 19,Sept. 28,92,69.7,81.89,82.06,83.78,88,66,73,77,81,95,75,100,91,88,n/a,88,113,n/a,n/a,113,n/a,n/a,n/a,n/a,n/a,39,36,n/a,n/a,73,n/a,n/a,n/a,n/a,n/a,62.01,78.19,n/a,n/a,88.69,n/a,n/a,n/a,n/a,,,
Alectoris_chukar,Chukar,412,38.5,28,Frumkin et al. 1986,,,,"Gang Ranch, Cariboo, Canada","Squamish-Lillooet, Canada (north of Stein Valley Nlaka'pamux Heritage park)","Squamish-Lillooet, Canada (north of Stein Valley Nlaka'pamux Heritage park)","Thompson-Nicola, Canada (east of Stein Valley Nlaka'pamux Heritage park)","Edge Hill Provincial Park, Thompson-Nicola, Canada","Maui, Hawaii","Al Ain, United Arab Emirates","Jebel Hafit, United Arab Emirates (near Al Ain)","Jebel Hafit, United Arab Emirates (near Al Ain)","Kula-Haleakala Natl Park, Maui, Hawaii",Sept. 15,August 28,August 12,March 27,July 5,53.86,62.29,64.07,45.79,76.25,50,52,57,42,66,57,70,72,50,87,Apr. 14,Jan. 1,January 11,January 15,December 12,77,67.16,71.5,65.7,74,72,57,61,54,66,83,79,84,73,85,n/a,103,100,79,104,n/a,n/a,n/a,n/a,n/a,n/a,14,-3,16,6,n/a,n/a,n/a,n/a,n/a,n/a,48.32,48.51,53.33,53.34,n/a,n/a,n/a,n/a,n/a,,,
Amphispiza_belli,sage sparrow,18.6,37,,Moldenhauer 1970,Not in the shared folder/ AGJ edits (9/15-added),,,"Kittitas, Washington","Douglas, Washington","Sageflats park, Douglas, Washington","Kittatas, Washington","Moses Coulee, Douglas, Washington","Jeff Davis, Texas","Hudspeth, Texas","Hudspeth, Texas","Guadalupe National Park, Hudspeth, Texas","Big Bend Ranch, Big Bend National Park, Texas",May 20,May 12,April 1,April 15,February 16,58.54,68.13,52.04,52.71,42.39,51,51,42,34,34,65,81,63,64,53,December 8,February 3,February 5,February 22,February 15,59.29,62.92,56.54,60.54,66.42,52,51,40,47,59,66,74,73,74,75,102,102,98,103,61,n/a,93,91,84,86,7,22,9,-4,27,n/a,18,25,18,31,56.5,58.12,50.43,51.86,42.46,n/a,52.42,54.87,48.19,53,,,
Amphispiza_bilineata,black-throated sparrow,11.6,36,*,Weathers 1981,,,,"Silver Lake, Oregon","Lake Albert, Oregon ","Owyhee, Idaho (south of Boise, near Morley Nelson Snake River Birds of Prey National Conservation Area)","Owyhee, Idaho (south of Boise, near Morley Nelson Snake River Birds of Prey National Conservation Area)","Owyhee, Idaho (south of Boise, near Morley Nelson Snake River Birds of Prey National Conservation Area)","Camino a Chichimequillas, Zacatecas, Mexico","Colonia Camino Real, Baja California Sur, Mexico","Ensenada de muertos, Baja California Sur, Mexico","Santiago Flores, Mexico (north of San Luis Potosi)","Villa de Arriaga, Mexico (south west of San Luis Potosi)",June 16,June 11,April 25,April 22,March 22,69.33,64.88,48.88,64.24,54.17,49,54,41,54,43,87,79,57,75,67,June 21,May 7,December 2,September 3,March 19,69.61,87.24,73.44,67.33,63.95,61,68,64,61,50,81,99,82,77,79,90,n/a,103,101,n/a,86,104,82,n/a,n/a,33,n/a,27,34,n/a,52,41,45,n/a,n/a,62.63,n/a,62.21,68.21,n/a,69.83,80.25,67.09,n/a,n/a,,,
Anhinga_anhinga,anhinga,1040,42,29.5,Hennemann 1983,,,,"Martin, North Carolina (on Roanoke River, east of Raleigh,NC)","Carson Wetland, Prince George, Virginia (south of Richmond and west of Norfolk)","Carson Wetland, Prince George, Virginia (south of Richmond and west of Norfolk)","Carson Wetland, Prince George, Virginia (south of Richmond and west of Norfolk)","Holy Shelter Game Land, Pender, North Carolina","Esteros de Farrapose e Islas del Río Uruguay, Uruguay (Uruguay River, south of Concepción del Uruguay)","Santo Tomé, Argentina (east of Parque Nacional Iberá; near border of Argentina and Brazil)","San Miguel, Parque Nacional Iberá, Argentina","Islas del Ibicuy, Argentina (north of Buenos Aires)","Carlos Pellegrini y Laguna Iberá, Argentina (in Parque Nacional Iberá)",May 4,April 18,April 8,June 12,April 26,76.4,67.38,51.79,83.71,61.34,70,52,36,73,53,86,83,66,93,68,December 27,February 2,February 23,May 7,May 15,86.33,83.5,83.86,54.22,70.71,68,68,70,50,59,97,93,91,59,79,99,97,92,93,90,n/a,n/a,n/a,n/a,n/a,25,15,15,17,39,n/a,n/a,n/a,n/a,n/a,71.42,62.69,63.45,63.96,67.52,n/a,n/a,n/a,n/a,n/a,,,
Athene_cunicularia,Burrowing owl,132.4,37,25,Coulombe 1970,,,,"Glasgow, Montana","Cascade, Montana (Southwest of Great Falls, MT)","Cascade, Montana (Southwest of Great Falls, MT)","Medicine Lake, Sheridan, Montana ( Northeastern Montana, near Fort Peck Indian Reservation)","Valley, Montana (just north of Glasgow, MT)","Biedma, Argentina (Península Valdés)","Biedma, Argentina (Península Valdés)","Florentino Ameghino, Argentina (North of Comodoro Rivadavia and south of Península Valdés, Argentina)","Rada Tilly, Escalante, Argentina (just south of Comodoro Rivadavia)","Playa El Doradillo, Biedma, Argentina (on Golfo Nuevo)",June 9,August 6,May 30,May 28,August 30,55.28,70.79,64.42,58.97,71.74,41,52,48,49,62,68,88,79,68,84,January 5,November 24,October 2,April 21,February 15,69.5,64.88,58.57,53.14,77.71,66,53,48,48,70,72,78,68,61,88,100,98,100,98,105,105,99,98,79,99,-15,1,30,-17,-11,39,38,32,19,20,50.37,56.75,63.51,47,46.25,62.14,65.63,62.63,49.73,56.8,,,
Aulacorhynchus_sulcatus,Groove-billed Toucanet,131.7,31,23,McNab and Bosque 2001,,,,"San Pedro de la Sierra, Magdalena, Columbia","Carrisillar, Venezuela (southwest of Parque Nacional Yurubí; in the mountains)","Parque Nacional Macarao, Venezuela (West of Caracas)","Parque Nacional Macarao, Venezuela (West of Caracas)","El Junquito, Venezuela (west of Caracas)","Parque Nacional Sierra Nevada, Venezuela (just north of Pico Bolívar)","Parque Nacional Sierra Nevada, Venezuela (","Parque Nacional Sierra de la Culata, Venezuela (northeast of Venezuela)","Parque Nacional El Tamá, Venezuela (South of San Cristobal)","Carrizal, Quita Soles, Venezuela (Northeast of Pico Humboldt)",June 14,December 30,January 6,May 22,February 15,87.76,78.18,n/a,84.27,81.36,79,75,n/a,79,75,93,81,n/a,91,90,December 12,September 18,February 25,June 15,May 7,77.76,84.76,81.26,78.95,78.85,73,77,73,75,82,84,93,88,82,95,100,90,97,93,100,95,99,99,102,102,73,70,68,75,73,72,66,70,70,70,85.04,79.16,81.33,82.62,80.76,81.51,80.89,81.45,82.41,81.63,,,
Baeolophus_wollweberi,Bridled Titmouse,10,38.6,,Weathers and Greene 1998,Not in the shared folder/ AGJ edits (9/15-added),,,"Prescott National Forest, Prescott, Arizona","Williams, Arizona (Coconino; southwest of Flagstaff)","Sycamore Canyon, Yavapai, Arizona","Yavapai, Arizona (west of Flagstaff)","Sycamore Canyon, Yavapai, Arizona","Cerro El Jovero, Mexico (Southeast of Colima, south of Cerro las Conchas)","Parque Ecológico Estatal Omiltemi, Mexico (west of Chilpancingo)","Vieja Estación de Ferrocarril de Erongaricuaro, Mexico (just north of Pátzcuaro, south of León)","Parque Nacional Volcán Nevado de Colima, Mexico (South of Guadalajara)","Parque Volcán Nevado de Colima, Mexico (Ciudad Guzman) ",July 3,April 18,January 29,March 16,February 16,74.96,43.87,37.13,51.43,48.29,58,30,23,34,30,86,60,54,69,65,May 22,May 1,June 18,January 15,May 20,76.19,83.13,72.36,71.9,80.19,66,77,64,63,73,84,90,77,79,86,97,81,101,101,91,n/a,102,n/a,n/a,n/a,14,22,16,20,23,n/a,70,n/a,n/a,n/a,60.52,51.62,55.03,60.13,53.68,n/a,81.98,n/a,n/a,n/a,,,
Bubo_virginianus,Great Horned Owl,1000,32.2,20.3,"Ganey, Balda and King 1993",,,,"Kanuti Lake, Yukon-Koyukuk, Alaska","Tolsona Wilderness, Valdez-Cordova, Alaska","Yukon, Canada (North of Kluane National Park and Reserve)","Healy Lake, Southeast Fairbanks, Alaska","Shageluk, Yukon, Alaska","Primavera, Chile (near Puerto Percy)","Monumento Natural Laguna de los Cisnes, Porvenir, Chile (east of Punta Arenas)","Languiñeo, Argentina (Piedra Parada, Northeast of Parque Nacional Corcovado)","Chos Malal, Argentina (South of Volcan Domuyo)","Lago Argentino, Argentina (East of Isla Wellington)",May 21,June 8,July 7,September 3,May 9,51.75,48.63,68.625,54.29,50.92,46,43,51,39,32,61,55,83,70,64,November 11,June 11,January 3,January 2,April 7,50.4,30,48,77.55,43.8,45,23,45,59,32,59,39,52,91,50,89,68,n/a,88,n/a,70,73,93,102,70,7,37,n/a,-35,n/a,32,14,13,28,23,45.54,50.76,n/a,38.27,n/a,48.94,39.34,52.41,68.09,43.55,,,
Cacatua_roseicapilla,Galah Cockatoo,271,33,22.5,Dawson and Fisher 1982,,,No data available in ebird,*,*,*,*,*,*,*,*,*,*,*,*,*,*,*,*,*,*,*,*,*,*,*,*,*,*,*,*,*,*,*,*,*,*,*,*,*,*,*,*,*,*,*,*,*,*,*,*,*,*,*,*,*,*,*,*,*,*,*,*,*,*,*,*,*,*,*,*,*,*,*,*,*,*,*,*,*,*,*,*,,,
Callipepla_californica,California Quail,149.6,37.5,27.3,Brush 1965,,,,"Salmon Arm, Coumbia-Shuswap, British Columbia, Canada","Salmon Arm, Coumbia-Shuswap, British Columbia, Canada","Salmon Arm, Coumbia-Shuswap, British Columbia, Canada","Little Shuswap Lake Home, Columbia-Shuswap, British Columbia, Canada (northeast of Kamloops)","Salmon Arm, Coumbia-Shuswap, British Columbia, Canada","Walter Peak, Queenstown-Lakes District, New Zealand (on Lake Wakatipu)","Bannockburn, New Zealand","Glendhu Bay, Otago, New Zealand (Queenstown-Lakes District)","Futaleufú, Argentina (Reserva Nacional Futaleufú)","Flea Bay, Christchurch City, New Zealand",May 3,August 10,August 27,March 29,January 17,56.21,79.21,73.63,48.63,34.17,41,61,56,31,30,70,97,92,63,36,October 8,February 28,December 15,April 16,October 21,53.63,61.38,65.75,40.88,60.25,48,51,56,35,42,59,73,75,48,72,96,103,100,86,101,82,78,82,83,95,18,14,-3,25,13,30,25,39,20,31,62.21,48.32,48.51,50.65,53.81,53.18,46.69,62.23,45.99,56.07,,,
Callipepla_gambelii,Gambel's Quail,160.7,41.1,*,Smith et al. 2015,,,,"Mesquite, Nevada (south of Beaver Dam Wash National Conservation Area)","Moapa Valley, Clark, Nevada (North of Valley of Fire State Park)","Motoqua, Utah (north of Beaver Dam Wash National Conservation Area)","Yellowjacket Canyon, Montezuma, Colorado","Grand Junction, Mesa, Colorado (just east of Colorado National Monument)","Estación de Campo Navopatia, Mexico (north of Los Mochis, south of Navojoa)","Nueva Casa de Teras, Ciudad Obregón, Mexico","Reserva Especial de la Biosfera Cajon del Diablo, Laguna Grande, Mexico","East Redford, Presidio, Texas (near Big Bend Ranch State Park)","Estación de Campo Navopatia, Mexico (West of El Carrizo)",November 13,January 8,May 14,May 23,August 14,52.92,50.83,68.13,48.55,81.42,42,48,53,34,66,68,54,83,64,96,January 21,February 3,March 2,December 14,January 8,68.81,72.28,74.8,59.2,70.21,54,55,61,34,57,79,84,84,75,81,74,77,104,91,96,n/a,n/a,n/a,n/a,n/a,24,30,24,-11,-4,n/a,n/a,n/a,n/a,n/a,45.71,52.61,66.73,45.76,52.01,n/a,n/a,n/a,n/a,n/a,,,
Cardinalis_cardinalis,Northern Cardinal,40,34,*,Dawson and Bartholomew 1958,,,,"Brainerd, Minnesota (East of Lake Hubert)","Grand Forks, Minnesota","Detroit Lakes, Minnesota","Grand Rapids, Minnesota","Caplan, Quebec, Canada (between Bonventure and New Richmond)","Freshwater Creek Forest Reserve, Belize (north of Crooked Tree Wildlife Sanctuary)","Barra Copalita, Mexico (northeast of Parque Nacional Huatulco)","Salchi, Mexico (southwest of Parque Nacional Huatulco)","Parque Nacional Huatulco, Mexico","Puerto Escondido, Mexico (Oaxaca)",June 19,January 2,May 13,February 12,July 18,59.38,5.17,68.04,-5.22,59.92,51,-5,45,-14,54,77,14,86,3,65,February 26,December 18,June 29,January 12,May 26,81,77.06,81.07,82.69,87.3,72,70,73,73,75,86,82,86,90,93,93,93,95,85,89,91,n/a,n/a,n/a,n/a,-22,-23,35,-28,3,66,n/a,n/a,n/a,n/a,48.83,40.35,62.95,37.97,48.96,82.51,n/a,n/a,n/a,n/a,,,
Cardinalis_cardinalis,Northern Cardinal,42.13,35.5,22,Pollock et al. 2019,Summer,,,"Brainerd, Minnesota (East of Lake Hubert)","Grand Forks, Minnesota","Detroit Lakes, Minnesota","Grand Rapids, Minnesota","Caplan, Quebec, Canada (between Bonventure and New Richmond)","Freshwater Creek Forest Reserve, Belize (north of Crooked Tree Wildlife Sanctuary)","Barra Copalita, Mexico (northeast of Parque Nacional Huatulco)","Salchi, Mexico (southwest of Parque Nacional Huatulco)","Parque Nacional Huatulco, Mexico","Puerto Escondido, Mexico (Oaxaca)",June 19,January 2,May 13,February 12,July 18,59.38,5.17,68.04,-5.22,59.92,51,-5,45,-14,54,77,14,86,3,65,February 26,December 18,June 29,January 12,May 26,81,77.06,81.07,82.69,87.3,72,70,73,73,75,86,82,86,90,93,93,93,95,85,89,91,n/a,n/a,n/a,n/a,-22,-23,35,-28,3,66,n/a,n/a,n/a,n/a,48.83,40.35,62.95,37.97,48.96,82.51,n/a,n/a,n/a,n/a,,,
Cardinalis_cardinalis,Northern Cardinal,42.13,32,14.7,Pollock et al. 2019,Winter,,,"Brainerd, Minnesota (East of Lake Hubert)","Grand Forks, Minnesota","Detroit Lakes, Minnesota","Grand Rapids, Minnesota","Caplan, Quebec, Canada (between Bonventure and New Richmond)","Freshwater Creek Forest Reserve, Belize (north of Crooked Tree Wildlife Sanctuary)","Barra Copalita, Mexico (northeast of Parque Nacional Huatulco)","Salchi, Mexico (southwest of Parque Nacional Huatulco)","Parque Nacional Huatulco, Mexico","Puerto Escondido, Mexico (Oaxaca)",June 19,January 2,May 13,February 12,July 18,59.38,5.17,68.04,-5.22,59.92,51,-5,45,-14,54,77,14,86,3,65,February 26,December 18,June 29,January 12,May 26,81,77.06,81.07,82.69,87.3,72,70,73,73,75,86,82,86,90,93,93,93,95,85,89,91,n/a,n/a,n/a,n/a,-22,-23,35,-28,3,66,n/a,n/a,n/a,n/a,48.83,40.35,62.95,37.97,48.96,82.51,n/a,n/a,n/a,n/a,,,
Carpodacus_cassinii (Haemorhous_cassinii),Cassin's Finch,28.1,37.5,22,Weathers et al. 1980,,,,"Cariboo, British Columbia, Canada","Cariboo, British Columbia, Canada","Thompson-Nicola, British Columbia, Canada","Cariboo, British Columbia, Canada","Dog Creek, Cariboo, British Columbia, Canada","Parque Nacional Sierra de San Pedro Mártir, Mexico","Bent, New Mexico","Parque Nacional Sierra de San Pedro Mártir, Baja California, Mexico","Gilman, Sandoval, New Mexico","Hermosa, New Mexico",March 15,August 8,May 24,May 29,May 23,42.46,73.29,52.46,58,63.58,34,55,44,49,52,52,86,63,64,73,June 11,February 21,June 3,January 10,March 7,95.71,34.92,88.45,23.25,51.68,76,26,72,17,37,110,44,104,32,62,n/a,n/a,94,n/a,n/a,n/a,108,n/a,84,85,n/a,n/a,36,n/a,n/a,n/a,16,n/a,8,25,n/a,n/a,62.33,n/a,n/a,n/a,68.62,n/a,44.84,61.84,,,
Cathartes_aura,Turkey Vulture,1380.3,40,25.6,"Arad and Bernstein, 1988",,,,"St. Paul, Alberta, Canada","Valemount, British Columbia, Canada (George Hicks Regional Park)","Rumsey Natural Area, Drumheller, Alberta, Canada","Prince Albert, Saskatchewan, Canada","Kenora, Ontario, Canada","Parque Etnobotánico Omora, Cabo de Hornos, Chile","Ushuaia, Argentina","Cerro Bandera, Cabo de Hornos, Chile","Isla Hornos, Cabo de Hornos, Chile","Isla Hornos, Cabo de Hornos, Chile",May 29,April 28,July 15,September 9,June 16,74.67,56.16,72.21,49.88,58.63,64,41,57,39,48,82,66,88,61,68,August 28,February 26,February 2,December 2,October 20,37.86,48.08,49.87,46.43,35.5,34,45,39,37,32,43,55,59,54,39,n/a,n/a,90,78,90,73,75,68,61,68,n/a,n/a,-24,3,37,25,32,18,37,32,n/a,n/a,37.86,39.37,63.9,42.56,46.71,43.28,46.45,44.54,,,
Collocalia_esculenta,Glossy Swiftlet,6.8,34,31.5,"McNab and Bonaccorso, 1995",,,,"Karakelong Island, Indonesia","Gunung Sahengbalira, Sulawesi Utara, Sangihe Island, Indonesia","Gunung Sahengbalira, Sulawesi Utara, Sangihe Island, Indonesia","Tangkoko Batuangus National Park, Sulawesi Utara, Soloman Islands, Indonesia","Sulawesi Utara, Sangihe Island, Indonesia (near Mount Awu)","Tetepare Nature Preserve, Tetepare, Solomon Islands","Rennell Island, Solomon Islands","Varirata National Park, Papua New Guinea","San Cristobal, Soloman Islands","near Baghare, Solomon Islands (San Cristobal)",September 4,September 16,July 24,January 16,May 11,81.125,80.83,81.13,80.53,81,74,73,77,73,76,87,89,86,91,86,March 28,July 19,July 25,December 27,November 17,80,80.5,78.64,79.56,n/a,75,70,75,73,n/a,90,90,86,90,n/a,n/a,n/a,n/a,n/a,n/a,n/a,n/a,n/a,n/a,n/a,n/a,n/a,n/a,n/a,n/a,n/a,n/a,n/a,n/a,n/a,n/a,n/a,n/a,n/a,n/a,n/a,n/a,n/a,n/a,n/a,,,
Collocalia_vanikorensis (Aerodramus_vanikorensis),Uniform Swiftlet,11.6,34,30,"McNab and Bonaccorso, 1995",,,,"Karakelong Island, Indonesia","Maluku Utara, Indonesia (Southwest of Halmahera)","Tangkoko Batuangus, Sulawesi Utara, Indonesia (north of Bitung)","Weda Forest, Maluku Utara, Indonesia","Tangkoko Batuangus, Sulawesi Utara, Indonesia","Port Vila, Vanuatu ","Pango Point, Port Vila, Vanuatu","Kuto, Isle of the Pines, New Caledonia","Alotau, Papua New Guinea","Pango Point, Port Vila, Vanuatu",November 21,September 11,March 11,February 28,March 25,80.75,81.38,80.9,78.5,78,76,76,73,77,70,86,88,93,80,90,May 26,December 21,October 18,July 6,October 4,72.91,78.86,n/a,79.63,73.75,64,73,n/a,75,68,84,86,n/a,84,79,n/a,n/a,n/a,n/a,n/a,n/a,n/a,n/a,n/a,n/a,n/a,n/a,n/a,n/a,n/a,n/a,n/a,n/a,n/a,n/a,n/a,n/a,n/a,n/a,n/a,n/a,n/a,n/a,n/a,n/a,,,
Columba_livia,Rock Pigeon,314.6,36.5,23,Calder and Schmidt-Nielsen 1967,,,,"Ugolnye Kopi, Russia","Vattarnesvegur, Fjarðabyggð, Iceland","Kiruna, Sweden","Vestmannaeyjabær, Iceland","Vadsø,  Norway (south of Varangerhalvøya Nasjonalpark)","Reserva Costera Urbana, Güer Aike, Argentina (Rio Gallegos)","Puntas Arenas, Chile (east of Reserva Nacional Magallanes)","Reserva Costera Urbana, Güer Aike, Argentina (Rio Gallegos)","Reserva Costera Urbana, Güer Aike, Argentina (Rio Gallegos)","Reserva Costera Urbana, Güer Aike, Argentina (Rio Gallegos)",June 4,June 30,September 22,May 28,March 17,46.08,50.28,46.8,46,34.2,36,49,41,46,26,57,52,52,46,39,April 15,October 30,January 22,May 10,September 15,49.13,42.75,58.29,33.39,35,43,36,52,23,27,61,50,70,50,43,81,n/a,n/a,64,n/a,63,66,82,n/a,73,-35,n/a,n/a,28,n/a,23,28,23,n/a,25,33.66,n/a,n/a,45.6,n/a,40.93,47.29,45.97,n/a,47.72,,,
Coragyps_atratus,Black Vulture,2100,40,25,Larochelle et al. 1982,,,,"Mount Peter Hawk Watch, Orange, New York","Mifflin, Pennsylvania","Lancaster, Pennsylvania","Putnam, New York","Putnam, New York","Region de Aysén del General Carlos Ibáñez del Campo, Chile","Aysén, Chile","Tortel, Chile","Cisnes, Chile",Puerto Chacabuco,September 3,May 16,May 12,May 26,August 22,74.84,58.11,54.4,73.5,69.83,69,55,51,59,59,81,60,59,86,81,January 1,July 8,September 30,October 22,October 26,47.93,18.44,50,54.25,45.56,41,10,42,36,39,92,25,58,72,50,93,90,95,96,92,82,84,n/a,82,79,18,42,41,30,24,18,7,n/a,21,23,54.02,66.02,70.1,65.51,63.35,43.99,42.82,n/a,50.47,48.87,,,
Coturnix_japonica,Japanese Quail,166,36,23.2,Ben-Hamo et al. 2010,,,,"Zhangjiaying, China","Kabanskiy Zakaznik, Russia","Muravyevka, Russia","Muravyevka, Russia","Muravyevka, Russia","Selenga hills, Russia (northwest of Ulan Ude)","Ogushigo, Japan","Junzi Peak, China (near Sanming)","Komatsu, Japan (near Ishikawa)","Laotieshan, China (near Dalian)",June 21,June 12,May 1,April 22,April 12,75.04,67.78,58.13,39.38,36.43,70,48,37,25,15,81,82,75,51,45,March 10,November 18,July 9,February 18,September 27,23.5,52.6,80.7,37.71,70.16,18,43,74,32,57,28,61,88,45,84,100,91,97,92,95,86,75,n/a,82,n/a,32,-42,37,-26,12,-2,28,n/a,27,n/a,69.76,40.62,64.94,39.06,60.17,44.48,51.26,n/a,48.13,n/a,,,
Cyanoramphus_novaezelandiae,Red-fronted Parakeet/Red Crowned Parakeet,56.1,37,22,McNab and Salisbury 1995,,,,"Poor Knights Islands, Whangarei District, New Zealand","Poor Knights Islands, Whangarei District, New Zealand","Lady Alice Island, New Zealand","Lady Alice Island, New Zealand","Little Barrier Island, Auckland City, New Zealand","Enderby Island, New Zealand","Maclaren Bay, Adams Island, New Zealand","Enderby Island, New Zealand","Rakiura National Park, Ulva Island, New Zealand","Rakiura National Park, Ulva Island, New Zealand",February 28,February 24,February 4,December 2,January 21,59.75,57.86,67,63.42,67.77,54,56,62,61,63,62,60,74,69,75,January 9,January 15,January 6,November 11,November 17,58.5,72,52.88,51.5,48.5,47,57,48,48,43,71,85,57,55,52,77,77,81,73,82,84,89,76,76,81,50,49,53,57,36,39,40,40,38,36,61.19,61.27,62.35,63.74,59.83,58.94,60.28,55.64,52.25,53.63,,,
Cygnus_olor,Mute Swan,9700,15,0.8,Bech 1980,winter birds did not have an accurate LCT,,,*,*,*,*,*,*,*,*,*,*,,*,*,*,*,*,*,*,*,*,*,*,*,*,*,*,*,*,*,*,*,*,*,*,*,*,*,*,*,*,*,*,*,*,*,*,*,*,*,*,*,*,*,*,*,*,*,*,*,*,*,*,*,*,*,*,*,*,*,*,*,*,*,*,*,*,*,*,*,*,,,
Ducula_pistrinaria,Island Imperial Pigeon,394.2,35,27,McNab 2000,,,,"Peter Haven, Garove Island, Papua New Guinea","Kimbe Bay, Malumalu Island, Papua New Guinea","Kimbe Bay, Malumalu Island, Papua New Guinea","Howae Island, Manus Islands, Papua New Guinea","Mount Rairaka, Bougainville Island, Papua New Guinea","Tetepare Nature Preserve, Tetepare, Solomon Islands","Naepaepa Mountain, San Cristobal, Solomon Islands","Nggela Pile Island, Solomon Islands","Russul Islands, Solomon Islands","Wemaregha, San Cristobal, Solomon Islands",September 27,July 20,July 25,October 18,December 21,77.75,n/a,n/a,n/a,n/a,73,n/a,n/a,n/a,n/a,82,n/a,n/a,n/a,n/a,June 16,June 28,October 8,May 6,December 2,78.69,77.94,n/a,n/a,n/a,73,73,n/a,n/a,n/a,86,84,n/a,n/a,n/a,n/a,n/a,n/a,n/a,n/a,n/a,n/a,n/a,n/a,n/a,n/a,n/a,n/a,n/a,n/a,n/a,n/a,n/a,n/a,n/a,n/a,n/a,n/a,n/a,n/a,n/a,n/a,n/a,n/a,n/a,,,
Ducula_zoeae,Zoe's Imperial Pigeon,456.6,32,19,McNab 2000,,,,"Malagufuk, Papua Barat, Indonesia (northeast of Sorong)","Sorong, Papua Barat, Indonesia","Nimbokrang, Indonesia (west of Jayapura)","Nimbokrang, Indonesia (west of Jayapura)","Nimbokrang, Indonesia (west of Jayapura)","Varirata National Park, Papua New Guinea","Varirata National Park, Papua New Guinea","Varirata National Park, Papua New Guinea","Nigila, Papua New Guinea (east of Alotau)","Varirata National Park, Papua New Guinea",June 13,March 16,September 29,October 6,July 29,81,82,80.67,82.55,81.35,75,77,73,75,73,87,90,88,91,88,October 10,May 30,July 31,April 25,June 26,80.07,n/a,n/a,78.5,n/a,77,n/a,n/a,77,n/a,84,n/a,n/a,79,n/a,n/a,n/a,n/a,n/a,n/a,n/a,n/a,n/a,n/a,n/a,n/a,n/a,n/a,n/a,n/a,n/a,n/a,n/a,n/a,n/a,n/a,n/a,n/a,n/a,n/a,n/a,n/a,n/a,n/a,n/a,,,
