Gallinula_ventralis,Black-tailed Native-hen (eBird gives scientific name as Tibonyx ventralis),309.2,40,20,"McNab and Ellis, 2006",,,,"Normanton-Floraville Rd, Bynoe River crossing, Carpentaria, Queensland, Australia","Parry Lagoons Nature Reserve--Marglu Billabong, Wyndham-East Kimberley, Western Australia, Australia","Parry Lagoons Nature Reserve--Marglu Billabong, Wyndham-East Kimberley, Western Australia, Australia","Kennedy Creek, Tablelands Highway, Barkly, Northern Territory, Australia","Ilparpa Claypans Crown Land Reserve, Alice Springs, Northern Territory, Australia","Lake Cartcarrong, Moyne, Victoria, Australia","Wingeel Rd, Wingeel (-38.046,143.857) Golden Plains, Victoria, Australia","Cockato Lake, Naracoorte and Lucindale, South Australia, Australia","Mundy Terrace, Robe, South Australia, Australia","Serendip Sanctuary, Greater Geelong, Victoria, Australia",November 3,June 30,July 2,January 22,August 30,78.76,71.72,69.63,87.48,82.9,73,57,57,82,79,88,90,88,91,86,May 18,April 29,April 11,January 11,January 1,58.19,50.17,57.39,78.78,73.44,48,37,43,61,61,66,66,66,95,90,93,95,95,n/a,96.33,73,70.5,70.33,n/a,78,77,80,81.75,n/a,82.33,60.33,56.5,54.67,n/a,58.2,82.75,86.49,86.89,n/a,87.3,64.54,60.94,60.57,n/a,66.56,,,
Gallirallus_australis_hectori,Weka,813.5,38,30,"McNab and Ellis, 2006",,,,"Ohope Scenic Reserve, Whakatane District, New Zealand","Collingwood Estuary, Tasman District, New Zealand","Opotiki--Hikuwai Beach, Opotiki District, New Zealand","Kawakawa Bay, Manukau City, Auckland, New Zealand","The Tree House, 168 West Coast Road, Motukaraka Hokianga, Kohukohu, New Zealand","Bench Island, Southland District, New Zealand","Bench Island, Southland District, New Zealand","South Passage Island - south-east, Southland District, New Zealand","Fiordland National Park--Milford Sound, Southland District, New Zealand","Fiordland National Park--Milford Sound, Southland District, New Zealand",October 6,June 25,December 15,April 22,March 8,56.63,52.55,67.69,63.55,67.65,52,48,57,57,63,61,55,75,72,73,February 9,October 22,November 24,December 31,February 9,70.87,55.5,60.87,54.37,55.12,63,42,55,49,51,79,68,70,60,62,75.33,67,79,71.4,73.5,71.6,81,85,76,87,63,56,66,60.2,60.67,51,59.5,62,55,60,67.63,59.32,70.28,63.74,64.97,59,69.44,69.38,64.5,67.63,,,
Gallirallus_philippensis_assimilis,Australian Banded Rail (in eBird as Buff-banded Rail),173.6,37,28,"McNab and Ellis, 2006",,,,"Laoag Bypass Road - Padsan River, Laoag City, Phillipines","Mt. Iraya, Basco, Batanes, Phillipines","Mt. Iraya, Basco, Batanes, Phillipines","Vayang Rolling Hils, Basco, Batanes, Phillipines","Banaue hotel, Banaue, Luzon, Phillipines","Kundy Island, Southland District, New Zealand","Yejele Beach, Mare, New Caledonia","Bethany Park Camp, Tasman District, New Zealand","Port Campbell National Park, Princetown, Corangamite, Victoria, Australia","Heyfield Racecourse Wetlands, Wellington, Victoria, Australia",March 27,February 9,February 13,March 17,February 11,81.95,82.5,77.22,81.09,83.57,75,75,72,79,75,91,90,84,93,91,September 4,September 5,December 21,June 14,December 3,43.25,59.88,61.68,50.24,58.42,35,54,52,46,46,52,66,70,57,72,n/a,n/a,n/a,n/a,n/a,80,74,89,77,108,n/a,n/a,n/a,n/a,n/a,57.5,53.5,62,58,73,n/a,n/a,n/a,n/a,n/a,67.94,61.37,74.63,66.33,88.71,,,
Goura_cristata,Western Crowned Pigeon,2187.2,35,19,McNab 2000,,,Ebird was being really weird and wouldn't give me specific sitings (just the purple squares no matter how much I zoomed in),,,,,,,,,,,,,,,,,,,,,,,,,,,,,,,,,,,,,,,,,,,,,,,,,,,,,,,,,,,,,,,,,,,,,,,,,,,,,,,,,,,
Hymenolaimus_malacorhynchos,Blue Duck,717.1,38,12,McNab 2003,,,,"Heaphy Track, Kahurangi National Park, Tasman district, New Zealand","61 Celia Street, Stratford, Taranaki, New Zealand","Te Araroa Trail, Pureora Forest Park, Ruapehu District, NZ","Whirinaki Forest Park, Whakatane District, New Zealand","Tongariro River at Turangi (Te Aho Rd), Taupo District, NZ","Lake Thomson Hut, Southland District, New Zealand","Fiordland National Park Lodge, Southland District, New Zealand","Rainbow Reach - Iris Burn, Southland District, NZ","Kepler Track - Iris Burn, Southland District, NZ","Milford Track - Glade Wharf to Clinton Hut, Southland 9679, New Zealand",January 8,October 11,November 28,December 29,November 11,72,54.87,65.62,60.75,64.25,63,44,63,56,58,81,61,69,66,72,Janaury 29,July 29,June 5,July 9,February 11,66.12,46,34,32.12,56.75,51,42,28,24,53,80,50,46,40,62,81,71.67,82,75,72,n/a,61.5,67,66,68.4,70,60.67,66,61,62,n/a,49,51,51.25,54,73.25,63.6,70.21,64.38,64.25,n/a,53.62,56.28,57.31,59.4,,,
Leucosarcia_melanoleuca,Wonga Pigeon,466.1,36,24,McNab 2000,,,,"Seaview Mountain Retreat (Turkey Beach) Gladstone, Queensland, Australia","Cania Gorge Tourist Retreat, North Burnett, Queensland, AU","Seventeen Seventy, Gladstone, Queensland, AU","Cania Gorge National Park, North Burnett, Queenland, AU  (24.7241,150.9939)","Carmilla Beach, Isaac, Queensland, Australia","Wirilda Environment Park, Latrobe, Victoria, AU","Wirilda Environment Park, Latrobe, Victoria, AU","Metung, East Gippsland, Victoria, AU","Nyermilang Park (-37.87567,147.92822), East Gippsland, Victoria, AU","Rokebby Recreation Reserve, Baw Baw, Victoria, AU",October 28,October 20,August 22,November 28,January 8,71.87,70.59,64.41,74.21,74.35,66,63,54,68,64,77,79,73,79,81,March 23,September 8,November 11,April 9,December 30,74.05,49.39,67.17,60.98,75.83,66,37,55,48,54,88,63,82,72,95,91.5,94,88,86,84.5,76.75,75,97.5,77,108,72.5,74,72,75,69.83,62.25,50,67,59.2,73,80.75,81,78,80.62,74.55,67.53,62.83,81.92,65.68,88.71,,,
Megacrex_inepta,New Guinea Flightless Rail,856.6,35,18,"McNab and Ellis, 2006",,,,"Watame Lodge, Papua New Guinea","Watame Lodge, Papua New Guinea",NA,"Kwatu Lodge (Wai Kelo River), Papua New Guinea",NA,NA,NA,NA,NA,NA,August 4,June 12,NA,March 19,NA,75,76.16,NA,87.63,NA,72,73,NA,79,NA,77,81,NA,95,NA,NA,NA,NA,NA,NA,NA,NA,NA,NA,NA,NA,NA,NA,NA,NA,NA,NA,NA,NA,NA,n/a,n/a,n/a,n/a,n/a,n/a,n/a,n/a,n/a,n/a,n/a,n/a,n/a,n/a,n/a,n/a,n/a,n/a,n/a,n/a,n/a,n/a,n/a,n/a,n/a,n/a,n/a,n/a,n/a,n/a,,,
Parus_major,Great Tit,18.97,33,*,Hissa and Palokangas 1970,,,,"Ørnesbukta, Norway","Batsfjord, Norway","Batsfjord, Norway","Sommarøy Arctic Hotel Tromsø AS, Sommaroy, Norway","Tana Valley, Luovtejok, Norway","Pars Special Economic Energy Zone, Iran","la palmeraie de massa - Auberge - Restaurant - Maison d'hôte - Massa, Morocco","Tajgalt, Souss Massa, Morocco","la palmeraie de massa - Auberge - Restaurant - Maison d'hôte - Massa, Morocco","Oued Massa, Aghorimze, Morocco",June 2,March 5,March 19,February 28,March 21,41.78,19.64,14,29.15,18,39,16,12,27,16,43,21,18,32,19,October 17,February 25,February 3,February 13,January 9,88.43,67.12,61,63,59.8,79,61,58,62,59,99,75,65,64,61,67,57.83,56.6,n/a,53.4,70,75,91,n/a,78,50.67,46.5,45,n/a,44.8,45,54,63.5,n/a,57.33,57.65,51.24,50.32,n/a,48.81,56.48,60.6,70.51,n/a,62.57,,,
Podiceps_nigricollis,Eared Grebe,317.4,38.1,15,Ellis and Jehl 2003,,,,"Hornborgasjön--Hångers udde, Sweden","Hornborgasjön--Naturum, Sweden","Frövisjön - Plattformen, Sweden","Hwy 3, Mackenzie River crossing, Northwest Territories, Canada","Wood Buffalo NP--Rocher at Coupe River, Forst McMurray, Alberta, Canada","Lake Michelle, Noordhoek, Capetown, South Africa","De Hoop Nature Reserve, South Africa","Shearwater Apartment, Simon's Town, South Africa","De Hoop Nature Reserve, South Africa","De Hoop Nature Reserve, South Africa",April 15,June 5,June 6,June 12,May 21,34.98,52.52,60.17,67.46,63.58,18,39,46,57,37,46,59,70,77,81,October 12,April 19,September 26,January 11,August 7,63.3,56.64,53.04,79.75,52.04,59,52,45,68,39,70,64,61,90,64,78,70.75,72.67,68,80.5,87.33,86,89.67,86.75,74.5,59,56.75,59,53.5,60.5,64,65,64,60.75,55,67.24,62.7,65.08,60.91,71.27,72.43,65.77,73.61,69.53,58.52,,,
Pteroglossus_aracari,Black-necked Aracari,200.7,35,29,McNab and Bosque 2001,,,,"Palmar-Rio Grande, Bolivar, Venezuela","Reserva Forestal del Caura--Las Trincheras, Venezuela","Transit 4 Aurora (6.7527, -59.7283), Cuyuni,Mazaruni, Guyana","Waini River base camp (8.1807,-59.4776), Guyana","El Palmar, Bolivar, Venezuela","Fazenda rio Vermelho, Rio de Janeiro, Brazil","Estrada Lumiar-Aldeia Velha (-22.395,-42.302), Rio de Janeiro, Brazil","Pedra de Tres Pontoes, Afonso Claudio, Brazil","Estrada do Helinho, Rio de Janeiro Brazil","Sumidouro, Rio de Janeiro, Brazil",December 12,February 21,February 7,July 25,November 16,77.54,74,78.08,76.75,80.35,73,71,75,73,77,86,84,84,88,86,August 23,July 29,March 16,October 19,July 3,67,77.48,81.04,77.92,72.65,64,70,75,75,70,70,86,88,84,77,n/a,n/a,n/a,n/a,n/a,92.33,93.67,94.67,94,96,n/a,n/a,n/a,n/a,n/a,75,79,75.16,72.5,74.67,n/a,n/a,n/a,n/a,n/a,82,81.88,81.16,80.87,81.34,,,
Baillonius_bailloni,Saffron Toucanet,133,34,19,McNab and Bosque 2001,,,,"Parque Nacional do Itatiaia--area geral, Rio de Janeiro, Brazil","Hotel Fazenda Monte Verde Golf & Resort, Vargem Alta -ES, Brazil","Mata do Caetes, Espirito Santo, Brazil","Reserva Mata do Passarinho, Bandeira, Brazil","Parque Estadual Intervales, Sao Paulo, Brazil","Non Moncona Virgin Lodge, San Pedro, Argentina","Estrada Geral do Braco (-27.1096,-48.7802), Camboriu, Brazil","Cueva Mini lodge and adventure, Eldorado, Argentina","Parque Provincial Salt Encantado, Misiones, Argentina","Parque Provincial Mocona, San Pedro, Argentina",March 6,October 21,March 22,November 9,November 18,83.46,71.28,76.54,80.08,81.09,79,64,72,72,77,91,77,84,86,88,August 18,July 1,January 9,October 22,March 17,78.13,76.17,81.92,82.09,83.04,73,70,79,79,81,82,82,86,86,86,93.33,95,94.4,96,98.5,88.67,82,89,88,88,77.67,77,74.2,78.5,79,63.67,61.67,68,64,68,82.55,82.43,81.27,85.22,85.85,73.9,68.46,75.15,72.65,74.18,,,
Ramphastos_dicolorus,Red-Breasted Toucan,328.9,34,20,McNab and Bosque 2001,,,,"Parque Nacional da Serrra do Gandarela (-20.1701,-43.7858), Minas Gerais, Brazil","Estrada Parque Nacional doCaparao (-20.41,-41.837), Minas Gerais, Brazil","Cachoeira do Cerradao, Minas Gerais, Brazil","Casca D'Anta waterfall Parque Nacional da Serra da Canastra, Sao Roque de Minas, Brazil","Parque Estadual de Serra do Mar-Nucleo Cunha, Sao Paulo, Brazil","Parque tematico (-31.611,-52.517), Rio Grade do Sul, Brazil","Santuario Nossa Senhora de Guadalupe, Rio Grande do Sul, Brazil","Sao Francisco de Paula--Pousada Recanto da Mata, Rio Grande do Sul, Brazil","Morro Reutra--area geral, Rio Grande do Sul, Brazil","Morro Reuter -- Estrada Jose Klauck, Rio Grande do Sul, Brazil",December 12,January 24,October 7,July 22,January 1,75,85.57,76.82,67.65,86.37,73,79,72,64,79,77,91,86,73,91,August 15,June 30,September 28,March 24,November 8,56.74,59.92,66,72.48,72.3,45,57,63,64,63,72,63,68,82,82,93,93.67,97.67,96.33,95.67,96,94.5,96.67,83,91.5,77,77,75.67,78,76.67,75.79,70.5,70.33,71,72.5,84.29,82.87,84.37,85.5,83.06,79.29,82.71,84.47,74.25,81.19,,,
Ramphastos_toco,Toco Toucan,634.8,34,17,McNab and Bosque 2001,,,,"Georgetown Botanical Gardens, Georgetown, Guyana","Warmuri Trail, Kukama, Guyana","Mahaicony River, Mahaicony, Guyana","Roraima (2.859, - 60.631), Boa Vista, Brazil","Georgetown Botanical Gardens, Georgetown, Guyana","Embrapa Clima Temperado, Rio Grand do Sul, Brazil","Santuario Nossa Senhora de Guadalupe, Rio Grande do Sul, Brazil","Santuario Nossa Senhora de Guadalupe, Rio Grande do Sul, Brazil","Estancia Virocay (AICA CR15), Santo Tome, Argentina","Parque Provincial Mocona, San Pedro, Argentina",January 13,June 30,February 27,December 16,February 21,77.26,77.7,78.16,85.2,76.62,70,73,73,79,72,86,86,88,93,84,June 9,June 30,October 28,November 5,March 18,61.15,63,68.64,80.75,77,41,59,63,68,60,72,68,72,99,95,n/a,n/a,n/a,n/a,n/a,96.75,n/a,95,91,89.6,n/a,n/a,n/a,n/a,n/a,68.25,n/a,69.5,73,70.8,n/a,n/a,n/a,n/a,n/a,80.27,n/a,80.55,78.7,77.64,,,
Ramphastos_tucanus,Red-Billed Toucan (in eBird as White-throated Toucan (Red-billed)),420.3,35,25,McNab and Bosque 2001,,,,"(-2.3576,-60.39925), Amazonas Brazil",NA,NA,NA,NA,"Reserva Florestal Adolhp Ducke, Manaus, Amazonas Brazil",NA,NA,NA,NA,September 26,NA,NA,NA,NA,78.75,NA,NA,NA,NA,73,NA,NA,NA,NA,91,NA,NA,NA,NA,August 12,NA,NA,NA,NA,83.91,NA,NA,NA,NA,73,NA,NA,NA,NA,93,NA,NA,NA,NA,93.67,n/a,n/a,n/a,n/a,95,n/a,n/a,n/a,n/a,77,n/a,n/a,n/a,n/a,79,n/a,n/a,n/a,n/a,83.97,n/a,n/a,n/a,n/a,87.64,n/a,n/a,n/a,n/a,,,
Trachyphonus_darnaudii,D'Arnaud's Barbet,36.6,38,35,McNab and Bosque 2001,,,,"Yabello--Elephant Rock, Oromia, Ethiopia","Turmi (general area), Ethiopia","Kidepo Valley National Park, Uganda","Kidepo Valley National Park, Uganda","Lake Baringo, Kenya","Madibira (-8.216,34.835), Mbeya Region, Tanzania","Ruaha River Lodge, Tanzania","Tarangire National Park--Tarangire Simba Lodge, Tanzania","Tarangire National Park--Tarangire Simba Lodge, Tanzania","Tarangire National Park--Tarangire Simba Lodge, Tanzania",January 15,February 1,May 2,July 4,August 7,65.5,no data,70.33,72.58,62.5,50,no data,64,68,59,77,no data,75,79,68,October 31,April 10,April 15,June 7,February 20,77.08,72.5,74.87,72.6,76,68,72,66,66,68,88,73,86,81,88,n/a,n/a,n/a,n/a,n/a,n/a,n/a,n/a,n/a,n/a,n/a,n/a,n/a,n/a,n/a,n/a,n/a,n/a,n/a,n/a,n/a,n/a,n/a,n/a,n/a,n/a,n/a,n/a,n/a,n/a,,,
Coturnix_chinensis,King Quail (in eBird as blue-breasted quail (synoicus chinensis)),47.3,42.2,30.1,Pis 2010,,,,"Baruipur Marches, South 24 Parganas, West Bengal, India","Deobali Jalah (26.247,92.604), Nagaon, India","Manas National Park-- Bhuyanpara (Eastern Range), Baksa, India","Maulana Azad Rd, Nagaon, India","Malasi Lake, Cabagan, Phillipines","Sentani Grassland, Papua, Indonesia","Diamond Head Road, Crowdy Bay National Park, New South Wales, AU","Kimbe Bay--Malumalu Island, Papua New Guina","Bindarrabi Bush Camp (Koreelah National Park), Tenterfield, New South Wales, AU","Flood Reserve Road, Lismore, New South Wales, AU",July 14,February 10,April 11,February 7,October 25,91.72,65.5,80,68.66,81.83,84,55,68,59,76,100,76,93,79,87,June 20,December 2,August 13,February 27,November 11,78,78,78.62,75.94,68.25,74,64,75,72,66,84,95,83,81,73,93.25,97.33,99.67,n/a,n/a,93,95,95,n/a,95,76,78,84,n/a,n/a,73,86,81,n/a,82,83.01,86.38,89.92,n/a,n/a,82.77,89,86.27,n/a,86.77,,,
Perdix_perdix,Grey Partridge,396.6,42.3,25.1,Pis 2010,,,,"Porvoo--Heinajarvi, Finland","Salo, Halikonlahti area, Finland","Jokiniemen Kissahoitola,Tyrnava, Finland","Landsbergaslatten, Uppsala Ian, Sweden","Lappi, Lumijoki, Finland","Sarilar, Turkey","Sarilar, Turkey","Saribeyler, Turkey","Kanibarazan wetland, Iran","Kafkas University Wetland, Turkey",January 23,November 27,May 26,December 17,June 9,28.25,20.15,54.1,34.19,52,25,12,45,30,41,30,25,64,37,61,August 2,July 22,November 26,March 21,March 19,83.52,84.57,58.56,43.63,56.8,77,75,54,32,48,91,93,68,54,64,72.5,41,63.75,45,66.5,90.33,93.33,73,94.6,95,52.5,37,51.75,37,52.75,69.33,71,55,72,67.5,62.24,38.63,57.3,42.46,58.47,77.25,79,60.22,80.84,79.68,,,
Phasianus_cholchicus,Ring-Necked Pheasant,74.2,41.4,29.3,Pis 2010,,,,"Lupi Hyllykallio, Seinajoki, Finland","Tuusniemi, Koivulahti, Finland","Sundom, Sweden","Nokkala, Finland","Kempeleenlahti Bay, Finland","Bahia Jara, Chile Chico, Chile","Bahia Jara, Chile Chico, Chile","Terra Luna Lodge, Chile Chico, Chile","Vista Hermosa, Coyhaique, chile","Pasado Cruce del Valle Simpson, Coyhaique, Chile",April 14,April 4,June 1,May 7,May 19,34.06,31.22,41.16,56.21,44.25,23,18,36,37,41,45,41,46,70,48,Septemer 17,October 26,April 4,April 10,June 21,52.25,57.25,52.2,44.62,35.68,47,50,48,19,32,58,63,55,63,39,76.33,73.5,62,65.75,72,72,78,65.5,66,63,57,54,50.25,54.25,55,51.33,51,52.5,50,49.3,66.16,63.17,55.93,61.06,63.92,62.3,63.74,56.69,55.23,54.12,,,
Carduelis_chloris,Greenfinches (in eBird as European Greenfinch),27,TNZ = 26,*,"Saarela, Klapper, and Heldmaier 1991",,,,"Berlevag skole, Norway","Honningsvag Harbor, Norway","Batsfjord, Norway","Vadsoya, Norway","Batsfjord, Norway","Campbell Island, New Zealand","Haldane Bay, Southland District, New Zealand","Stewart Island/Rakiura Mason Bay, New Zealand","Waipapa Point Lighthouse, Southland District, New Zealand","Tokanui Gorge Rd Hwy and Mataura River, Southland District, New Zealand",August 4,March 28,March 19,April 1,May 26,40.5,30.08,14,32,37.93,39,26,12,23,37,41,33,18,37,39,December 12,December 11,January 8,September 24,December 9,59.5,55.25,52.62,48.87,52.5,53,48,50,47,48,70,61,55,53,57,52.33,59,57.2,66.25,57.75,81,83,79,75,91,44.67,47.8,46,51.25,47.5,56,61,58.67,53,62,48.35,52.42,51.06,58.88,51.92,64,72.25,67.08,62.5,74.63,,,
Carduelis_spinus,Siskins (in eBird as Eurasian Siskin),13.5,TNZ = 29,*,"Saarela, Klapper, and Heldmaier 1991",,,,"Hotelli Korpikartano, Menesjarvi, Finland","Melkefoss, Norway","Kjolnes Lighthouse, Norway","Straumsbukta, Norway","Melkefoss, Norway","Al Sila, United Arab Emirates","Urayarah, Saudi Arabia","Al-Shallal's Farm, Kuwait","Al-Shallal's Farm, Kuwait","Guishan Island, Taiwan",July 30,June 15,June 7,June 7,June 13,51.92,57,54.75,43.45,47.62,46,48,45,41,41,57,64,64,46,52,November 22,January 5,November 10,December 18,April 26,70.64,61.78,75.17,53.29,76.9,61,50,63,43,70,79,79,86,64,82,60,67.25,69,64.5,66.5,86,97.67,88.5,90,111,51.33,52.5,54.67,51,52.75,75,79.33,76.5,72,97,55.2,60.08,61.21,57.56,58.47,79.4,85.23,81.48,79.5,101.29,,,
Oena_capensis,African Namaqua Dove (in eBird as Namaqua Dove),36.4,40,32,Schleucher 1999,,,,"Altinkum Plaji, Cyprus","Mobarakiyeh, Iran","Fakhrabad, Iran","Estagfirullah, Turkey","Beit HaArava, Israel","Duiwenhoks River mouth, South Africa","De Hoop Nature Reserve, South Africa","Van Dyks Bay, South Africa","Springerbaai Coastal Eco Estate, South Africa","De Mond Nature Reserve, South Africa",April 26,January 5,December 29,October 26,April 24,66.55,38.62,51.23,71.8,61,55,27,36,64,54,81,57,59,76,66,December 14,October 17,December 27,January 19,November 1,63.14,57.6,64.24,67.79,55.7,54,52,54,61,52,75,64,73,77,59,95.5,88.4,68,73.5,n/a,91,89,90,87.6,96.5,74,69.6,54,56.5,n/a,66,65.5,66,61.6,68,81.97,79.57,59.07,64.04,n/a,74.68,72.86,77.07,70.46,79.1,,,
Parus_atricapillus,Black-capped Chickadee,12,27,0,Chaplin 1976,,,,*,*,*,*,*,*,*,*,*,*,*,*,*,*,*,*,*,*,*,*,*,*,*,*,*,*,*,*,*,*,*,*,*,*,*,*,*,*,*,*,*,*,*,*,*,*,*,*,*,*,*,*,*,*,*,*,*,*,*,*,*,*,*,*,*,*,*,*,*,*,*,*,*,*,*,*,*,*,*,*,,,
Poecile_atricapillus,Black-capped Chickadee,11.2,36,23.5,Pollock et al. 2019,Summer,,**,"Kfar Ruppin fishponds, Israel","Mosul Lake--dam outlet, Iraq","Tal Or, Israel","Arikhiya Farm, Qatar","Mara Triangle, Kenya","Rust De Winter Nature Reserve Limpopo, South Africa","North Uthungulu (-27.9358,32.2394), South Africa","Nagana, South Africa","Rooikatkloof Nature Preserve, South Africa","Mkhuze, South Africa",July 16,June 24,June 24,June 7,July 8,83.08,92.7,79.46,96.13,65.14,77,75,72,84,59,90,104,86,109,73,July 27,July 13,June 22,June 24,June 14,54.22,54.12,56.19,53.04,68.12,41,41,43,39,60,68,66,73,66,84,n/a,n/a,n/a,n/a,93.25,n/a,87.5,n/a,n/a,89,n/a,n/a,n/a,n/a,69.53,n/a,61.75,n/a,n/a,62,n/a,n/a,n/a,n/a,70.92,n/a,70.76,n/a,n/a,70.51,,,
Poecile_atricapillus,Black-capped Chickadee,11.2,33.4,14.1,Pollock et al. 2019,Winter,,**,"Khatmat Milahah, Oman","Sulaibiya Pivot Fields-Southern Section, Kuwait","Beit HaArava, Israel","Pivot Fields, Kuwait","Sulaibiya Pivot Fields- Southern Section, Kuwait","Witzenberg Valley Road (-33.228,19.317), Western Cape, South Africa","Rooisand Nature Reserve, South Africa","West Coast National Park Marine Protected Area, South Africa","De Hoop Nature Reserve, South Africa","Baakensrug Farm, Nelspoort, South Africa",February 22,January 2,February 20,February 19,January 28,70.66,62.38,53.71,65.08,63.46,64,52,41,52,54,75,70,64,82,73,January 7,January 13,January 24,January 11,February 23,68.21,71.76,68.25,79.75,71,63,64,63,68,63,75,81,73,90,81,n/a,n/a,n/a,n/a,n/a,91,n/a,88,97,91.33,n/a,n/a,n/a,n/a,n/a,68,n/a,68,72,62.5,n/a,n/a,n/a,n/a,n/a,78.69,n/a,74.96,81.96,71.23,,,
Nyctea_scandiaca,Snowy owl,1800,18.5,2.5,Gessaman 1972,Winter - Cited in West and Norton 1975,,,"Rield Recreation Park, Edmonton, Alberta, Canada","Grand Prairie, Alberta, Canada","Rang Road 233, Edmonton, Alberta, Canada","Riviere Qui Barre, Edmonton, Alberta, Canada","Cardiff, Alberta, Canada","Dover Air Force Base, Kent, Delaware, United States","West Point, King William, Virginia, United States","Coles County, Illinois, United States","Dover Air Force Base, Kent, Delaware, United States","Sandborn, Knox, Indiana, United States",January 1,February 9,February 14,January 9,January 10,27.1,-8.54,33.72,-6.06,3.38,14,-24,25,-17,0,36,5,43,1,5,January 17,January 1,January 7,February 2,January 24,33.13,14.21,10.13,40.54,29.07,31,5,3,31,20,36,22,19,47,39,n/a,68,70.33,69,n/a,n/a,70,60,79,n/a,n/a,38.5,42.5,44.67,n/a,n/a,53,40,61,n/a,n/a,52.67,52.68,54.92,n/a,n/a,58.76,49,69.8,n/a,,,
Cyanoliseus_patagonus,Burrowing parrot (in eBird as Burrowing Parakeet),250,35,15,Zungu et al. 2013,,,,"Payogasta, Cachi, Argentina","Salta rafting (-25.293,-65.272), La Vina, Argentina","Cabra Coral, La Vina, Argentina","Campo Kilampa-Tala Canada, Pocho, Argentina","Las Calles, San Alberto, Argentina","Estrada Caleta Cordova, Escalante, Argentina","Ruta Provincial 270, Sarmiento, Argentina","Bosque pertrificado Sarmiento, Sarmiento, Argentina","Aeropuerto Internacional Almirante Marcos A. Zar, Rawson, Argentina","Puerto Madryn, Biedma, Argentina",February 26,May 1,March 10,January 10,October 24,60.58,69.83,65.6,74.68,56.61,57,64,61,64,50,64,75,73,86,68,January 15,February 11,August 26,November 12,December 1,68.83,62.26,51.91,65.67,58.54,61,45,45,54,48,79,79,63,77,66,90.2,87.75,86,88.16,91,98.5,93,93,89.5,91,65.8,64.25,60.67,63.67,68,71.5,70,60,66,66,71.63,70.54,69.33,69.23,78.96,83.96,80.69,66.33,76.93,76.68,,,
Cardinalis_cardinalis,Arizona cardinal or northern cardinal,41.3,42,29,"Hinds and Calder, 1973",,,,"Carlton Park Community Club, Prince Albert, Saskatchewan, Canada","Brule Lake campsite, Cook, Minnesota, United States","Bear Head Lake, St. Louis, Minnesota, United states","28 Lakeview Dr, Terrace Bay, Ontario, Canada","Sainte-Rose-du-Nord, Le Fjord-du-Saguenay, Quebec, Canada","Puerto Angel, Oaxaca, Mexico","Punta Cometa, Oaxaca, Mexico","Parque Nacional Huatulco, Oaxaca, Mexico","Puerto Angel, Oaxaca, Mexico","Playa Zipolite, Oxaca, Mexico",July 26,July 5,July 5,November 6,March 2,65.94,77.04,81.67,37.88,19.21,61,69,73,34,9,77,83,91,41,25,January 12,February 18,March 6,March 26,March 25,80.84,81.5,82.33,82.46,84.46,72,73,75,72,75,86,88,88,88,90,61.33,63,65.25,52.5,n/a,88,88.33,89.67,87.25,n/a,40.33,41,41,33,n/a,61,66,65.67,63.75,n/a,48,50.57,51.91,43.35,n/a,75.12,77.33,77.94,75.64,n/a,,,
Callipepla_squamata,Chestnut-bellied scaled quail (in eBird as Scaled Quail),150,35,25,Kline et al. 2019,,,,"Edison BBS Rte--start, El Paso County, Colorado, United states","Miami-Yoder School, Rush, Colorado","Wild Horse, Cheyenne County, Colorado, United States","Ellicott, El Paso County, Colorado, United States","Aroya, Cheyenne County, Colorado, United states","San Pablo Toliman (20.796,-99.918), Queretaro, Mexico","Mesa Las Prenada, Aguascalientes, Mexico","San Jose del Alamito, San Jose de vindeo, Coahuila, Mexico","Charcas, San Luis Potosi, Mexico","Tequisquiapan, Queretaro, Mexico",June 21,June 6,April 14,May 21,May 8,55.61,76.79,61.5,67.69,48.75,49,61,43,54,47,66,93,78,83,51,August 29,July 8,January 13,September 4,June 4,65.52,67.37,57.42,62.73,66.6,54,59,37,57,52,79,77,75,70,81,99,102,84.2,96.5,83,82.67,81.25,85,82,84.25,73,69,53.2,65,53,57.33,60,56,58,62.5,84.67,87.79,67.88,80.53,67.92,68.92,69.4,67.78,68.61,73.13,,,
Ammoperdix_heyi,Sand partridge,172,>51,30,Frumkin et al. 1986,,,,"Beit HaArava, Israel","Fasa'il, Israel","Hemdat, Israel","Mitspe Shalem, Israel","Beit HaArava, Israel","Mudayy, Oman","Underwater Observatory Park, Eilat, Israel","Munay, United Arab Emirates","Al Ain, United Arab Emirates","Mirbat, Oman",February 24,December 8,February 16,August 28,February 26,56.96,59.52,50.7,84.42,66.68,46,57,46,81,50,68,63,54,88,73,December 1,February 1,November 13,January 8,May 26,79.5,55.41,84.38,68.71,89.39,73,45,81,63,86,88,68,88,77,113,n/a,n/a,n/a,n/a,n/a,86,103.67,88.5,102.75,106,n/a,n/a,n/a,n/a,n/a,75,87.5,76.5,85.25,87.25,n/a,n/a,n/a,n/a,n/a,79.4,93.18,81.48,91.79,95.26,,,
Onychognathus_tristramii,Tristram's Starling,123,36.5,21.5,Dmi'el and Tel-Tzur 1985,,,,"Ein Al-Auja, Israel","Ma'ale Efraim (32.081, 35.38), Israel","Ma'ale Efraim, Israel","Ma'ale Adumim, Israel","Yahel, Israel","Salalah, Oman","Dahariz Beach-Khor End, Oman","The Inter-University Institute for Marine Sciences, Israel","Crowne Plaza Resort, Salalah, Oman","Dahariz Beach-Khor End, Oman",October 19,October 28,January 21,October 22,May 9,76.33,no data,no data,no data,no data,70,no data,no data,no data,no data,82,no data,no data,no data,no data,August 10,April 13,March 28,January 27,March 16,76.57,83.39,81.65,75.92,78.09,75,81,75,73,72,79,88,86,79,84,n/a,n/a,n/a,n/a,n/a,113,108.5,105.2,105.2,101.5,n/a,n/a,n/a,n/a,n/a,95,92.25,90.2,88.4,85,n/a,n/a,n/a,n/a,n/a,101.83,98.26,94.86,94.74,89.44,,,
Columba_livia,Rock pigeon/ Rock dove,369,42,30,Marder and Ariela 1988,,,,"Honningsvag Harbor, Norway","Honningsvag Harbor, Norway","Hammerfest, Norway","Vadso Harbour, Norway","Kirkenes, Norway","Glaciar Marrtial, Ushuaia, Argentina","Reserva Natural Urana Bahia Encerrada, Ushuaia, Argentina","Rio de los Ciervos, Punta Arena, Chile","Reserva Natural Urana Bahia Encerrada, Ushuaia, Argentina","Laguna Azul-Santa Cruz, Guer Aike, Argentina",May 21,March 28,August 6,March 5,June 13,no data,no data,no data,no data,no data,no data,no data,no data,no data,no data,no data,no data,no data,no data,no data,February 24,February 17,June 20,January 18,October 18,40.54,47.79,36.13,48.58,44.13,36,43,34,46,37,45,50,39,52,50,n/a,n/a,n/a,n/a,n/a,n/a,n/a,n/a,n/a,n/a,n/a,n/a,n/a,n/a,n/a,n/a,n/a,n/a,n/a,n/a,n/a,n/a,n/a,n/a,n/a,n/a,n/a,n/a,n/a,n/a,,,
